{"authority":{"deployment_authorized":false,"local_runtime_candidate":true,"owner_reviewed":true,"production_approved":false,"provider_calls":0,"runtime_installed":false},"bundle_id":"ikb-ava-home-services-concierge-7356aa","bundle_sha256":"6d60526fd0ba0082a626bbc04ae7b85d678bced082ef91cd267fc9b4300b5503","entries":[{"entry_id":"K-0001","kind":"REFERENCE","source":{"file":"website-01-summit-home-services-enhance-your-home-today-get.md","file_sha256":"ea5188514d6f8b121b80b3eb5c798364374ade28b6c56d6eef926442b39be404","line_end":20,"line_start":20},"statement":"We deliver power-packed construction and maintenance solutions that dominate deadlines and crush downtime.","title":"Maintain Stronger."},{"entry_id":"K-0002","kind":"CAPABILITY","source":{"file":"website-01-summit-home-services-enhance-your-home-today-get.md","file_sha256":"ea5188514d6f8b121b80b3eb5c798364374ade28b6c56d6eef926442b39be404","line_end":24,"line_start":24},"statement":"With over 10 years of experience in home building and remodeling throughout the greater Jackson area, we know quality craftsmanship and dependable service matter. We also recognized a growing need for a company dedicated to smaller projects, repairs, and everyday home maintenance — the jobs homeowners need done right without the hassle of calling multiple contractors.","title":"Relentless Craft. Unshakable Results."},{"entry_id":"K-0004","kind":"REFERENCE","source":{"file":"website-01-summit-home-services-enhance-your-home-today-get.md","file_sha256":"ea5188514d6f8b121b80b3eb5c798364374ade28b6c56d6eef926442b39be404","line_end":56,"line_start":36},"statement":"Picture, mirror, and TV mounting; Shelf and storage installation; Door hardware and lock installation; Weatherstripping replacement; Blind and curtain rod installation; Insulation installation and repair; Ceiling repair and texture matching; Interior painting and touch ups","title":"Interior repairs"},{"entry_id":"K-0005","kind":"REFERENCE","source":{"file":"website-01-summit-home-services-enhance-your-home-today-get.md","file_sha256":"ea5188514d6f8b121b80b3eb5c798364374ade28b6c56d6eef926442b39be404","line_end":88,"line_start":68},"statement":"Cabinet removal and replacement; Replacing cabinet doors and drawer fronts; Repairing damaged cabinet boxes, frames, and shelves; Fixing cabinets that have pulled away from the wall or are no longer level; Baseboard installation and replacement throughout the entire home; Door casing and window casing installation and repair; Door installation, adjustment, and repair; Window installation, repair and replacement; Attic and crawl space inspection and repair; Garage door repair and maintenance","title":"Carpentry"},{"entry_id":"K-0006","kind":"REFERENCE","source":{"file":"website-01-summit-home-services-enhance-your-home-today-get.md","file_sha256":"ea5188514d6f8b121b80b3eb5c798364374ade28b6c56d6eef926442b39be404","line_end":108,"line_start":96},"statement":"Hardwood floor installation and repair; Stair repair and refinishing; Laminate and vinyl flooring installation and repair; Tile floor installation and repair; Carpet installation and repair; Subfloor repair and replacement; Grout cleaning, repair, and replacement","title":"flooring"},{"entry_id":"K-0007","kind":"REFERENCE","source":{"file":"website-01-summit-home-services-enhance-your-home-today-get.md","file_sha256":"ea5188514d6f8b121b80b3eb5c798364374ade28b6c56d6eef926442b39be404","line_end":132,"line_start":116},"statement":"Appliance installation and hookup; Cabinet installation and repair; Countertop installation and replacement; Sink and faucet installation and repair; Garbage disposal installation and repair; Dishwasher installation and repair; Tile backsplash installation and repair; Kitchen lighting installation; Outlet and electrical repair","title":"kitchens"},{"entry_id":"K-0008","kind":"REFERENCE","source":{"file":"website-01-summit-home-services-enhance-your-home-today-get.md","file_sha256":"ea5188514d6f8b121b80b3eb5c798364374ade28b6c56d6eef926442b39be404","line_end":158,"line_start":142},"statement":"Shower and tub installation and repair; Shower/tub surrounds or tile.; Vanity and sink installation; Toilet installation and repair; Tile installation and repair; Waterproofing and moisture barrier; Exhaust fan installation and repair; Plumbing repair and replacement; Mirror and fixture installation","title":"bathrooms"},{"entry_id":"K-0009","kind":"REFERENCE","source":{"file":"website-01-summit-home-services-enhance-your-home-today-get.md","file_sha256":"ea5188514d6f8b121b80b3eb5c798364374ade28b6c56d6eef926442b39be404","line_end":202,"line_start":170},"statement":"Exterior painting and staining; Siding repair and replacement; Exterior door installation and repair; Gutter cleaning, repair, and replacement; Soffit and fascia repair and replacement; Railing installation and repair; Porch repair and restoration; Fence installation and repair; Screen repair and replacement; Pergola and gazebo installation and repair; Outdoor stair repair and replacement; Mailbox installation and repair","title":"exterior repairs"},{"entry_id":"K-0010","kind":"REFERENCE","source":{"file":"website-01-summit-home-services-enhance-your-home-today-get.md","file_sha256":"ea5188514d6f8b121b80b3eb5c798364374ade28b6c56d6eef926442b39be404","line_end":210,"line_start":210},"statement":"Electrical inspections and troubleshooting","title":"electrical"},{"entry_id":"K-0011","kind":"REFERENCE","source":{"file":"website-01-summit-home-services-enhance-your-home-today-get.md","file_sha256":"ea5188514d6f8b121b80b3eb5c798364374ade28b6c56d6eef926442b39be404","line_end":268,"line_start":212},"statement":"Faulty wiring diagnosis and repair; Wiring upgrades and replacements; Panel inspections, upgrades, and breaker replacement; Fuse box to breaker panel conversion; Standard and GFCI outlet installation and repair; AFCI and USB outlet installation; Dimmer and smart switch installation; Light fixture installation and replacement; Recessed lighting installation; Ceiling fan installation and replacement; Chandelier and pendant lighting installation; Under cabinet and accent lighting; Exterior and security lighting installation; Landscape and pathway lighting; Dedicated circuits for appliances and equipment; Generator hookup and transfer switch installation; Hot tub and spa electrical hookup; Cable, coaxial, and ethernet wiring; Smart home device installation and wiring; Doorbell and intercom installation; Smoke and carbon monoxide detector installation; Smart thermostat installation; Outdoor outlet and weatherproof outlet installation; Shed and detached garage electrical hookup; Pool and spa electrical hookup and bonding","title":"electrical"},{"entry_id":"K-0012","kind":"CAPABILITY","source":{"file":"website-02-about-schedule-your-home-solutions-today-summit-.md","file_sha256":"c9f072d02cbad88f9ca5663cb9233008226ed36dc2af9045e3c356fd4750bfde","line_end":24,"line_start":16},"statement":"At Summit Home Services, we provide dependable home repairs, maintenance, remodeling, and improvement services for homeowners across Central Mississippi. From small repairs to larger home upgrades, our goal is simple: make home projects easier by providing reliable, quality service all in one place.; We specialize in the jobs homeowners often struggle to find dependable help for — the repairs, installations, and maintenance items that pile up over time. Instead of calling multiple contractors, homeowners can rely on one trusted team to handle a wide range of home service needs.; Our services include fixture and appliance installation, door and window replacement, cabinet repairs and upgrades, flooring, broken tile repair, fascia and soffit repair, TV mounting, hardware installation, punch-list items, general maintenance, and kitchen and bathroom improvements — along with many other residential repair and remodeling services.; With over 10 years of hands-on experience in home building, remodeling, and construction, we understand what quality workmanship looks like. Summit Home Services was built to fill the need for dependable, honest service focused on everyday repairs, maintenance, and home improvements — the jobs that matter to homeowners but often get overlooked.","title":"Built To Dominate"},{"entry_id":"K-0013","kind":"POLICY","source":{"file":"website-02-about-schedule-your-home-solutions-today-summit-.md","file_sha256":"c9f072d02cbad88f9ca5663cb9233008226ed36dc2af9045e3c356fd4750bfde","line_end":22,"line_start":22},"statement":"We also partner with realtors and homeowners to complete inspection repairs and project items that may require licensed professionals, helping homes move smoothly through the buying and selling process.","title":"Built To Dominate"}],"identity":{"agent_name":"Ava","client_name":"Summit Home Services","role_title":"Home Services Concierge"},"mission_id":"draft-ava-home-services-concierge-20260826-014140-bb4a8c","schema_version":"0.1","source_binding":{"approval_sha256":"2940f1d263faa85fcb934169076e73a9967308d89b9dee3fb06e2a384ac73b0a","compilation_id":"kc-summit-home-services-website-knowl-20260826-014052-5f6688","compilation_sha256":"8f6f56cdab5c74f89351c46a3a44a90a167a6de34433af33139bf1cd95763b4a","manifest_sha256":"d70d3d4d59cba1ad7a12b7120d6016a5422060663164860c4c25114969c06ce1","package_id":"kp-summit-home-services-website-knowledge-20260826-014045-797ab5","review_id":"kr-summit-home-services-website-knowl-20260826-014057-7356aa","review_sha256":"ce8c65331ec4fa36cf7aa2906826f382197e3b225b67fcefd7e55bba54c6fcf1"},"status":"LOCAL_INSTANCE_KNOWLEDGE_READY_NOT_DEPLOYED"}
